legacy_trial_reference,audit_version,factor_id,factor_family,signal_validity,portfolio_validity,status,finding,trial_ledger_imported,not_imported_reason,counts_toward_multiple_testing,eligible_for_promotion,research_only,live_order_effect
audit-v2.2-low_vol_20d,Audit v2.2,low_vol_20d,defensive_quality,PASS,FAIL,REFERENCE_SIGNAL,signal survives basic audit but unconditional long-only portfolio fails; structural and dynamic volatility must be separated,false,missing immutable trial identity and point-in-time snapshot,false,false,true,none
audit-v2.2-rev_xs_20d,Audit v2.2,rev_xs_20d,reversal,FAIL,UNKNOWN,RETIRED,cross-sectional reversal signal did not survive the historical audit,false,missing immutable trial identity and point-in-time snapshot,false,false,true,none
audit-v2.2-funding_fade,Audit v2.2,funding_fade,derivatives_crowding,UNKNOWN,UNKNOWN,DATA_PENDING,"real multi-year funding, basis, and open-interest history is unavailable; proxy evidence cannot support validation",false,missing immutable trial identity and point-in-time snapshot,false,false,true,none
audit-v2.1-production_20d_momentum,Audit v2.1,production_20d_momentum,momentum,FAIL,UNKNOWN,RETIRED,legacy momentum result failed independent audit and is disabled,false,missing immutable trial identity and point-in-time snapshot,false,false,true,none
audit-v2.1-vol_adjusted_momentum,Audit v2.1,vol_adjusted_momentum,momentum,FAIL,UNKNOWN,RETIRED,volatility-adjusted momentum did not retain independent signal evidence,false,missing immutable trial identity and point-in-time snapshot,false,false,true,none
audit-v2-volume_dry_reversal,Audit v2,volume_dry_reversal,reversal,FAIL,UNKNOWN,RETIRED,historical audit rejected the reversal overlay,false,missing immutable trial identity and point-in-time snapshot,false,false,true,none
audit-v2-pullback_uptrend,Audit v2,pullback_uptrend,timing,FAIL,UNKNOWN,RETIRED,historical audit rejected the timing overlay,false,missing immutable trial identity and point-in-time snapshot,false,false,true,none
audit-v1-failed_alpha158_overlays,Audit v1,failed_alpha158_overlays,legacy_overlay,FAIL,UNKNOWN,RETIRED,enumerated Alpha158 overlays failed multiple-testing governance,false,missing immutable trial identity and point-in-time snapshot,false,false,true,none
